{
  "schema": "validation-run/v1",
  "env": {
    "pystatistics_version": "3.20.0",
    "install_source": "pypi",
    "python": "3.11.14",
    "numpy": "2.3.5",
    "os": "Linux-6.8.0-107-generic-x86_64-with-glibc2.39",
    "cpu": "x86_64",
    "device": "cuda",
    "torch": "2.11.0.dev20251226+cu128",
    "available_devices": [
      "cuda",
      "cpu"
    ],
    "gpu_name": "NVIDIA GeForce RTX 5070 Ti",
    "cuda_version": "12.8",
    "host": "forge"
  },
  "config": {
    "study": "gpu_glm_stability",
    "lam": 100.0,
    "grid": [
      [
        100000,
        64
      ],
      [
        200000,
        128
      ],
      [
        500000,
        128
      ]
    ]
  },
  "records": [
    {
      "engine": "pystatistics:gpu",
      "dataset": "glm_poisson",
      "n": 100000,
      "p": 64,
      "model_key": "glm_poisson",
      "lam": 100.0,
      "plain_status": "converged",
      "plain_rel_vs_cpu": 2.434821200657514e-07,
      "ridge_status": "converged",
      "ridge_rel_vs_cpu_ridge": 3.070403338713554e-05,
      "fp64_status": "converged",
      "fp64_rel_vs_cpu": 1.1042410551563943e-14
    },
    {
      "engine": "pystatistics:gpu",
      "dataset": "glm_poisson",
      "n": 200000,
      "p": 128,
      "model_key": "glm_poisson",
      "lam": 100.0,
      "plain_status": "converged",
      "plain_rel_vs_cpu": 1.7347228144561108e-06,
      "ridge_status": "converged",
      "ridge_rel_vs_cpu_ridge": 3.482734318838781e-05,
      "fp64_status": "converged",
      "fp64_rel_vs_cpu": 1.561247400715335e-14
    },
    {
      "engine": "pystatistics:gpu",
      "dataset": "glm_poisson",
      "n": 500000,
      "p": 128,
      "model_key": "glm_poisson",
      "lam": 100.0,
      "plain_status": "converged",
      "plain_rel_vs_cpu": 1.3014058464271854e-06,
      "ridge_status": "converged",
      "ridge_rel_vs_cpu_ridge": 3.438652630738444e-05,
      "fp64_status": "converged",
      "fp64_rel_vs_cpu": 1.8907728594752627e-14
    },
    {
      "engine": "pystatistics:gpu",
      "dataset": "glm_gamma",
      "n": 100000,
      "p": 64,
      "model_key": "glm_gamma",
      "lam": 100.0,
      "plain_status": "converged",
      "plain_rel_vs_cpu": 2.6624620865212384e-07,
      "ridge_status": "converged",
      "ridge_rel_vs_cpu_ridge": 6.4032152968400775e-06,
      "fp64_status": "converged",
      "fp64_rel_vs_cpu": 1.0521448428421983e-14
    },
    {
      "engine": "pystatistics:gpu",
      "dataset": "glm_gamma",
      "n": 200000,
      "p": 128,
      "model_key": "glm_gamma",
      "lam": 100.0,
      "plain_status": "converged",
      "plain_rel_vs_cpu": 1.3320468681644496e-06,
      "ridge_status": "converged",
      "ridge_rel_vs_cpu_ridge": 5.048619787679114e-06,
      "fp64_status": "converged",
      "fp64_rel_vs_cpu": 1.4952672375609096e-14
    },
    {
      "engine": "pystatistics:gpu",
      "dataset": "glm_gamma",
      "n": 500000,
      "p": 128,
      "model_key": "glm_gamma",
      "lam": 100.0,
      "plain_status": "converged",
      "plain_rel_vs_cpu": 9.836762333626945e-07,
      "ridge_status": "converged",
      "ridge_rel_vs_cpu_ridge": 2.876648192525521e-06,
      "fp64_status": "converged",
      "fp64_rel_vs_cpu": 2.448958993372063e-14
    }
  ]
}