{
  "schema": "validation-run/v1",
  "env": {
    "pystatistics_version": "3.13.0",
    "install_source": "editable",
    "python": "3.11.14",
    "torch": "2.11.0.dev20251226+cu128",
    "os": "Linux-6.8.0-107-generic-x86_64-with-glibc2.39",
    "device": "cuda",
    "host": "forge",
    "note": "bootstrap snapshot flattened from gpu-mice-paper; editable-install provenance"
  },
  "config": {
    "source_file": "r_fidelity_cuda.json",
    "study": "r_fidelity_cuda",
    "n_envelopes": 6
  },
  "records": [
    {
      "engine": "pystatistics:cpu",
      "dataset": "n1000_pmm",
      "n": 1000,
      "p": 6,
      "backend_name": "mice_cpu",
      "loglik": null,
      "n_iter": null,
      "converged": null,
      "wall_median_s": 1.1948417024686933,
      "wall_min_s": 1.1917566554620862,
      "wall_max_s": null,
      "wall_times_s": null,
      "method": "pmm",
      "fidelity_max_diff": 0.018491835577904916,
      "speedup_cpu_over_r": 7.113913066842185
    },
    {
      "engine": "pystatistics:gpu",
      "dataset": "n1000_pmm",
      "n": 1000,
      "p": 6,
      "backend_name": "mice_gpu",
      "loglik": null,
      "n_iter": null,
      "converged": null,
      "wall_median_s": 0.08010583929717541,
      "wall_min_s": 0.08007445000112057,
      "wall_max_s": null,
      "wall_times_s": null,
      "method": "pmm",
      "speedup_gpu_over_r": 106.10961790771371
    },
    {
      "engine": "r:mice",
      "dataset": "n1000_pmm",
      "n": 1000,
      "p": 6,
      "backend_name": "r_mice",
      "loglik": null,
      "n_iter": null,
      "converged": null,
      "wall_median_s": 8.5,
      "wall_min_s": null,
      "wall_max_s": null,
      "wall_times_s": null,
      "r_version": "3.19.0"
    },
    {
      "engine": "pystatistics:cpu",
      "dataset": "n1000_norm",
      "n": 1000,
      "p": 6,
      "backend_name": "mice_cpu",
      "loglik": null,
      "n_iter": null,
      "converged": null,
      "wall_median_s": 0.5633210884407163,
      "wall_min_s": 0.5590644301846623,
      "wall_max_s": null,
      "wall_times_s": null,
      "method": "norm",
      "fidelity_max_diff": 0.04161628753190883,
      "speedup_cpu_over_r": 12.996140478718221
    },
    {
      "engine": "pystatistics:gpu",
      "dataset": "n1000_norm",
      "n": 1000,
      "p": 6,
      "backend_name": "mice_gpu",
      "loglik": null,
      "n_iter": null,
      "converged": null,
      "wall_median_s": 0.06018474604934454,
      "wall_min_s": 0.060156695544719696,
      "wall_max_s": null,
      "wall_times_s": null,
      "method": "norm",
      "speedup_gpu_over_r": 121.64211832010764
    },
    {
      "engine": "r:mice",
      "dataset": "n1000_norm",
      "n": 1000,
      "p": 6,
      "backend_name": "r_mice",
      "loglik": null,
      "n_iter": null,
      "converged": null,
      "wall_median_s": 7.321,
      "wall_min_s": null,
      "wall_max_s": null,
      "wall_times_s": null,
      "r_version": "3.19.0"
    },
    {
      "engine": "pystatistics:cpu",
      "dataset": "n5000_pmm",
      "n": 5000,
      "p": 10,
      "backend_name": "mice_cpu",
      "loglik": null,
      "n_iter": null,
      "converged": null,
      "wall_median_s": 6.893825961276889,
      "wall_min_s": 6.877934358082712,
      "wall_max_s": null,
      "wall_times_s": null,
      "method": "pmm",
      "fidelity_max_diff": 0.005713246653527619,
      "speedup_cpu_over_r": 7.265341521723442
    },
    {
      "engine": "pystatistics:gpu",
      "dataset": "n5000_pmm",
      "n": 5000,
      "p": 10,
      "backend_name": "mice_gpu",
      "loglik": null,
      "n_iter": null,
      "converged": null,
      "wall_median_s": 0.14499342162162066,
      "wall_min_s": 0.14132628031075,
      "wall_max_s": null,
      "wall_times_s": null,
      "method": "pmm",
      "speedup_gpu_over_r": 345.4363614558044
    },
    {
      "engine": "r:mice",
      "dataset": "n5000_pmm",
      "n": 5000,
      "p": 10,
      "backend_name": "r_mice",
      "loglik": null,
      "n_iter": null,
      "converged": null,
      "wall_median_s": 50.086,
      "wall_min_s": null,
      "wall_max_s": null,
      "wall_times_s": null,
      "r_version": "3.19.0"
    },
    {
      "engine": "pystatistics:cpu",
      "dataset": "n5000_norm",
      "n": 5000,
      "p": 10,
      "backend_name": "mice_cpu",
      "loglik": null,
      "n_iter": null,
      "converged": null,
      "wall_median_s": 2.824151039123535,
      "wall_min_s": 2.815015859901905,
      "wall_max_s": null,
      "wall_times_s": null,
      "method": "norm",
      "fidelity_max_diff": 0.014335097612526715,
      "speedup_cpu_over_r": 14.57889448178306
    },
    {
      "engine": "pystatistics:gpu",
      "dataset": "n5000_norm",
      "n": 5000,
      "p": 10,
      "backend_name": "mice_gpu",
      "loglik": null,
      "n_iter": null,
      "converged": null,
      "wall_median_s": 0.11245511379092932,
      "wall_min_s": 0.11116347275674343,
      "wall_max_s": null,
      "wall_times_s": null,
      "method": "norm",
      "speedup_gpu_over_r": 366.12830321390896
    },
    {
      "engine": "r:mice",
      "dataset": "n5000_norm",
      "n": 5000,
      "p": 10,
      "backend_name": "r_mice",
      "loglik": null,
      "n_iter": null,
      "converged": null,
      "wall_median_s": 41.173,
      "wall_min_s": null,
      "wall_max_s": null,
      "wall_times_s": null,
      "r_version": "3.19.0"
    },
    {
      "engine": "pystatistics:cpu",
      "dataset": "n20000_pmm",
      "n": 20000,
      "p": 20,
      "backend_name": "mice_cpu",
      "loglik": null,
      "n_iter": null,
      "converged": null,
      "wall_median_s": 60.71665578242391,
      "wall_min_s": 60.68062951788306,
      "wall_max_s": null,
      "wall_times_s": null,
      "method": "pmm",
      "fidelity_max_diff": 0.006738309407030817,
      "speedup_cpu_over_r": 9.886101140862882
    },
    {
      "engine": "pystatistics:gpu",
      "dataset": "n20000_pmm",
      "n": 20000,
      "p": 20,
      "backend_name": "mice_gpu",
      "loglik": null,
      "n_iter": null,
      "converged": null,
      "wall_median_s": 1.2115970505401492,
      "wall_min_s": 1.204474271275103,
      "wall_max_s": null,
      "wall_times_s": null,
      "method": "pmm",
      "speedup_gpu_over_r": 495.4213116748663
    },
    {
      "engine": "r:mice",
      "dataset": "n20000_pmm",
      "n": 20000,
      "p": 20,
      "backend_name": "r_mice",
      "loglik": null,
      "n_iter": null,
      "converged": null,
      "wall_median_s": 600.251,
      "wall_min_s": null,
      "wall_max_s": null,
      "wall_times_s": null,
      "r_version": "3.19.0"
    },
    {
      "engine": "pystatistics:cpu",
      "dataset": "n20000_norm",
      "n": 20000,
      "p": 20,
      "backend_name": "mice_cpu",
      "loglik": null,
      "n_iter": null,
      "converged": null,
      "wall_median_s": 26.48674303572625,
      "wall_min_s": 26.42175356950611,
      "wall_max_s": null,
      "wall_times_s": null,
      "method": "norm",
      "fidelity_max_diff": 0.008360950426977496,
      "speedup_cpu_over_r": 19.912942836670602
    },
    {
      "engine": "pystatistics:gpu",
      "dataset": "n20000_norm",
      "n": 20000,
      "p": 20,
      "backend_name": "mice_gpu",
      "loglik": null,
      "n_iter": null,
      "converged": null,
      "wall_median_s": 0.8387634195387363,
      "wall_min_s": 0.8302533533424139,
      "wall_max_s": null,
      "wall_times_s": null,
      "method": "norm",
      "speedup_gpu_over_r": 628.8173610266058
    },
    {
      "engine": "r:mice",
      "dataset": "n20000_norm",
      "n": 20000,
      "p": 20,
      "backend_name": "r_mice",
      "loglik": null,
      "n_iter": null,
      "converged": null,
      "wall_median_s": 527.429,
      "wall_min_s": null,
      "wall_max_s": null,
      "wall_times_s": null,
      "r_version": "3.19.0"
    }
  ]
}