{
  "schema": "validation-run/v1",
  "env": {
    "pystatistics_version": "4.8.0",
    "install_source": "pypi",
    "python": "3.13.13",
    "numpy": "2.4.6",
    "os": "macOS-26.5.1-arm64-arm-64bit-Mach-O",
    "cpu": "arm",
    "device": "cpu",
    "torch": "2.13.0",
    "available_devices": [
      "mps",
      "cpu"
    ],
    "host": "powerhouse"
  },
  "config": {
    "study": "default_degeneracy_r15",
    "coef_tol": 1e-06,
    "dev_tol": 1e-06,
    "reference": "R glm(binomial) on the every-unique-event-time design",
    "cases": [
      "lung_default",
      "continuous_seed1",
      "continuous_seed2",
      "continuous_seed3",
      "separation_extreme"
    ]
  },
  "records": [
    {
      "engine": "default_r15:cpu",
      "dataset": "lung_default",
      "n": 227,
      "p": 3,
      "case": "lung_default",
      "n_events": 164,
      "n_intervals": 138,
      "person_period_n": 15809,
      "pystat_behavior": "returns; GLM converged=True (8 it); covariate inference sound",
      "r_behavior": "converged=True (8 it), 0 warning(s), max|coef|=5.9",
      "match": "behaviour-match",
      "cov_coef_max_rel_vs_r": 1.847867117724265e-15,
      "cov_se_max_rel_vs_r": 0.0,
      "baseline_hazard_max": 0.20242929048538794,
      "max_abs_glm_coef": 5.897548812427149,
      "deviance_rel_vs_r": 2.794336329501239e-15,
      "aic_rel_vs_r": 2.170076821804718e-15,
      "detail": "R warns=none; py_max|coef|=5.9"
    },
    {
      "engine": "default_r15:cpu",
      "dataset": "continuous_seed1",
      "n": 120,
      "p": 2,
      "case": "continuous_seed1",
      "n_events": 78,
      "n_intervals": 78,
      "person_period_n": 4611,
      "pystat_behavior": "returns; GLM converged=True (7 it); covariate inference sound",
      "r_behavior": "converged=True (7 it), 0 warning(s), max|coef|=4.8",
      "match": "behaviour-match",
      "cov_coef_max_rel_vs_r": 4.306565617683989e-15,
      "cov_se_max_rel_vs_r": 2.283416710025865e-16,
      "baseline_hazard_max": 0.37761461786623557,
      "max_abs_glm_coef": 4.797955892477621,
      "deviance_rel_vs_r": 5.049881515102744e-15,
      "aic_rel_vs_r": 4.155029608686466e-15,
      "detail": "R warns=none; py_max|coef|=4.8"
    },
    {
      "engine": "default_r15:cpu",
      "dataset": "continuous_seed2",
      "n": 120,
      "p": 2,
      "case": "continuous_seed2",
      "n_events": 77,
      "n_intervals": 77,
      "person_period_n": 4295,
      "pystat_behavior": "returns; GLM converged=True (12 it); covariate inference sound",
      "r_behavior": "converged=True (12 it), 0 warning(s), max|coef|=13.7",
      "match": "behaviour-match",
      "cov_coef_max_rel_vs_r": 1.4454027140284899e-15,
      "cov_se_max_rel_vs_r": 2.279011865940857e-16,
      "baseline_hazard_max": 0.99999888383317,
      "max_abs_glm_coef": 13.705609099750726,
      "deviance_rel_vs_r": 6.383439388344748e-16,
      "aic_rel_vs_r": 2.612331179112473e-16,
      "detail": "R warns=none; py_max|coef|=13.7"
    },
    {
      "engine": "default_r15:cpu",
      "dataset": "continuous_seed3",
      "n": 120,
      "p": 2,
      "case": "continuous_seed3",
      "n_events": 68,
      "n_intervals": 68,
      "person_period_n": 4372,
      "pystat_behavior": "returns; GLM converged=True (7 it); covariate inference sound",
      "r_behavior": "converged=True (7 it), 0 warning(s), max|coef|=4.86",
      "match": "behaviour-match",
      "cov_coef_max_rel_vs_r": 1.2204423476160402e-15,
      "cov_se_max_rel_vs_r": 0.0,
      "baseline_hazard_max": 0.5606285746560488,
      "max_abs_glm_coef": 4.861052794515366,
      "deviance_rel_vs_r": 1.376652497759132e-15,
      "aic_rel_vs_r": 9.939439213328602e-16,
      "detail": "R warns=none; py_max|coef|=4.86"
    },
    {
      "engine": "default_r15:cpu",
      "dataset": "separation_extreme",
      "n": 60,
      "p": 2,
      "case": "separation_extreme",
      "n_events": 60,
      "n_intervals": 60,
      "person_period_n": 1830,
      "pystat_behavior": "returns; GLM converged=True (12 it); covariate inference sound",
      "r_behavior": "converged=True (12 it), 0 warning(s), max|coef|=13.8",
      "match": "behaviour-match",
      "cov_coef_max_rel_vs_r": 1.182573706527144e-16,
      "cov_se_max_rel_vs_r": 2.2742043504518657e-16,
      "baseline_hazard_max": 0.9999989449485511,
      "max_abs_glm_coef": 13.761919970520083,
      "deviance_rel_vs_r": 1.521364198805652e-15,
      "aic_rel_vs_r": 1.118735756110583e-15,
      "detail": "R warns=none; py_max|coef|=13.8"
    }
  ]
}