{
  "schema": "validation-run/v1",
  "env": {
    "pystatistics_version": "3.15.0",
    "install_source": "editable",
    "python": "3.12.13",
    "torch": "2.12.0",
    "os": "macOS-26.5.1-arm64-arm-64bit",
    "device": "mps",
    "host": "mac",
    "note": "bootstrap snapshot flattened from gpu-mice-paper; editable-install provenance"
  },
  "config": {
    "source_file": "r_fidelity_mps_v315.json",
    "study": "r_fidelity_mps",
    "n_envelopes": 6
  },
  "records": [
    {
      "engine": "pystatistics:cpu",
      "dataset": "n1000_pmm",
      "n": 1000,
      "p": 6,
      "backend_name": "mice_cpu",
      "loglik": null,
      "n_iter": null,
      "converged": null,
      "wall_median_s": 1.3464208340155892,
      "wall_min_s": 1.34342666703742,
      "wall_max_s": null,
      "wall_times_s": null,
      "method": "pmm",
      "fidelity_max_diff": 0.01453308807190503,
      "speedup_cpu_over_r": 6.185287533885246
    },
    {
      "engine": "pystatistics:gpu",
      "dataset": "n1000_pmm",
      "n": 1000,
      "p": 6,
      "backend_name": "mice_gpu",
      "loglik": null,
      "n_iter": null,
      "converged": null,
      "wall_median_s": 0.8629519999958575,
      "wall_min_s": 0.8489448750042357,
      "wall_max_s": null,
      "wall_times_s": null,
      "method": "pmm",
      "speedup_gpu_over_r": 9.65059470288032
    },
    {
      "engine": "r:mice",
      "dataset": "n1000_pmm",
      "n": 1000,
      "p": 6,
      "backend_name": "r_mice",
      "loglik": null,
      "n_iter": null,
      "converged": null,
      "wall_median_s": 8.328,
      "wall_min_s": null,
      "wall_max_s": null,
      "wall_times_s": null,
      "r_version": "3.19.0"
    },
    {
      "engine": "pystatistics:cpu",
      "dataset": "n1000_norm",
      "n": 1000,
      "p": 6,
      "backend_name": "mice_cpu",
      "loglik": null,
      "n_iter": null,
      "converged": null,
      "wall_median_s": 0.7637448330060579,
      "wall_min_s": 0.7621297080186196,
      "wall_max_s": null,
      "wall_times_s": null,
      "method": "norm",
      "fidelity_max_diff": 0.04161628753190906,
      "speedup_cpu_over_r": 9.593518258135154
    },
    {
      "engine": "pystatistics:gpu",
      "dataset": "n1000_norm",
      "n": 1000,
      "p": 6,
      "backend_name": "mice_gpu",
      "loglik": null,
      "n_iter": null,
      "converged": null,
      "wall_median_s": 0.7445721669937484,
      "wall_min_s": 0.7338837499846704,
      "wall_max_s": null,
      "wall_times_s": null,
      "method": "norm",
      "speedup_gpu_over_r": 9.840550486305673
    },
    {
      "engine": "r:mice",
      "dataset": "n1000_norm",
      "n": 1000,
      "p": 6,
      "backend_name": "r_mice",
      "loglik": null,
      "n_iter": null,
      "converged": null,
      "wall_median_s": 7.327,
      "wall_min_s": null,
      "wall_max_s": null,
      "wall_times_s": null,
      "r_version": "3.19.0"
    },
    {
      "engine": "pystatistics:cpu",
      "dataset": "n5000_pmm",
      "n": 5000,
      "p": 10,
      "backend_name": "mice_cpu",
      "loglik": null,
      "n_iter": null,
      "converged": null,
      "wall_median_s": 8.497271000000183,
      "wall_min_s": 8.407772957987618,
      "wall_max_s": null,
      "wall_times_s": null,
      "method": "pmm",
      "fidelity_max_diff": 0.010041715577237653,
      "speedup_cpu_over_r": 6.067124374401957
    },
    {
      "engine": "pystatistics:gpu",
      "dataset": "n5000_pmm",
      "n": 5000,
      "p": 10,
      "backend_name": "mice_gpu",
      "loglik": null,
      "n_iter": null,
      "converged": null,
      "wall_median_s": 1.932931333023589,
      "wall_min_s": 1.9175801660167053,
      "wall_max_s": null,
      "wall_times_s": null,
      "method": "pmm",
      "speedup_gpu_over_r": 26.6714078866716
    },
    {
      "engine": "r:mice",
      "dataset": "n5000_pmm",
      "n": 5000,
      "p": 10,
      "backend_name": "r_mice",
      "loglik": null,
      "n_iter": null,
      "converged": null,
      "wall_median_s": 51.554,
      "wall_min_s": null,
      "wall_max_s": null,
      "wall_times_s": null,
      "r_version": "3.19.0"
    },
    {
      "engine": "pystatistics:cpu",
      "dataset": "n5000_norm",
      "n": 5000,
      "p": 10,
      "backend_name": "mice_cpu",
      "loglik": null,
      "n_iter": null,
      "converged": null,
      "wall_median_s": 3.9575762499589473,
      "wall_min_s": 3.928546125011053,
      "wall_max_s": null,
      "wall_times_s": null,
      "method": "norm",
      "fidelity_max_diff": 0.014335097612525605,
      "speedup_cpu_over_r": 11.033015472652721
    },
    {
      "engine": "pystatistics:gpu",
      "dataset": "n5000_norm",
      "n": 5000,
      "p": 10,
      "backend_name": "mice_gpu",
      "loglik": null,
      "n_iter": null,
      "converged": null,
      "wall_median_s": 1.6958363329758868,
      "wall_min_s": 1.6823161669890396,
      "wall_max_s": null,
      "wall_times_s": null,
      "method": "norm",
      "speedup_gpu_over_r": 25.7477677243638
    },
    {
      "engine": "r:mice",
      "dataset": "n5000_norm",
      "n": 5000,
      "p": 10,
      "backend_name": "r_mice",
      "loglik": null,
      "n_iter": null,
      "converged": null,
      "wall_median_s": 43.664,
      "wall_min_s": null,
      "wall_max_s": null,
      "wall_times_s": null,
      "r_version": "3.19.0"
    },
    {
      "engine": "pystatistics:cpu",
      "dataset": "n20000_pmm",
      "n": 20000,
      "p": 20,
      "backend_name": "mice_cpu",
      "loglik": null,
      "n_iter": null,
      "converged": null,
      "wall_median_s": 83.27242462499999,
      "wall_min_s": 83.24351549998391,
      "wall_max_s": null,
      "wall_times_s": null,
      "method": "pmm",
      "fidelity_max_diff": 0.005409452699036744,
      "speedup_cpu_over_r": 7.522862494049783
    },
    {
      "engine": "pystatistics:gpu",
      "dataset": "n20000_pmm",
      "n": 20000,
      "p": 20,
      "backend_name": "mice_gpu",
      "loglik": null,
      "n_iter": null,
      "converged": null,
      "wall_median_s": 5.141665666014887,
      "wall_min_s": 5.122260334028397,
      "wall_max_s": null,
      "wall_times_s": null,
      "method": "pmm",
      "speedup_gpu_over_r": 121.83736568883826
    },
    {
      "engine": "r:mice",
      "dataset": "n20000_pmm",
      "n": 20000,
      "p": 20,
      "backend_name": "r_mice",
      "loglik": null,
      "n_iter": null,
      "converged": null,
      "wall_median_s": 626.447,
      "wall_min_s": null,
      "wall_max_s": null,
      "wall_times_s": null,
      "r_version": "3.19.0"
    },
    {
      "engine": "pystatistics:cpu",
      "dataset": "n20000_norm",
      "n": 20000,
      "p": 20,
      "backend_name": "mice_cpu",
      "loglik": null,
      "n_iter": null,
      "converged": null,
      "wall_median_s": 41.64721141703194,
      "wall_min_s": 40.99053470796207,
      "wall_max_s": null,
      "wall_times_s": null,
      "method": "norm",
      "fidelity_max_diff": 0.008360950426977364,
      "speedup_cpu_over_r": 13.08174020451205
    },
    {
      "engine": "pystatistics:gpu",
      "dataset": "n20000_norm",
      "n": 20000,
      "p": 20,
      "backend_name": "mice_gpu",
      "loglik": null,
      "n_iter": null,
      "converged": null,
      "wall_median_s": 3.316657125018537,
      "wall_min_s": 3.311319667031057,
      "wall_max_s": null,
      "wall_times_s": null,
      "method": "norm",
      "speedup_gpu_over_r": 164.26720624519032
    },
    {
      "engine": "r:mice",
      "dataset": "n20000_norm",
      "n": 20000,
      "p": 20,
      "backend_name": "r_mice",
      "loglik": null,
      "n_iter": null,
      "converged": null,
      "wall_median_s": 544.818,
      "wall_min_s": null,
      "wall_max_s": null,
      "wall_times_s": null,
      "r_version": "3.19.0"
    }
  ]
}