{
  "schema": "validation-run/v1",
  "env": {
    "pystatistics_version": "4.2.3",
    "install_source": "pypi",
    "python": "3.13.13",
    "numpy": "2.4.6",
    "os": "macOS-26.5.1-arm64-arm-64bit-Mach-O",
    "cpu": "arm",
    "device": "mps",
    "torch": "2.12.1",
    "available_devices": [
      "mps",
      "cpu"
    ],
    "host": "powerhouse"
  },
  "config": {
    "study": "gpu_glm_stability",
    "lam": 100.0,
    "grid": [
      [
        100000,
        64
      ],
      [
        200000,
        128
      ],
      [
        500000,
        128
      ]
    ]
  },
  "records": [
    {
      "engine": "pystatistics:gpu",
      "dataset": "glm_poisson",
      "n": 100000,
      "p": 64,
      "model_key": "glm_poisson",
      "lam": 100.0,
      "plain_status": "converged",
      "plain_rel_vs_cpu": 2.7013399000196953e-07,
      "ridge_status": "converged",
      "ridge_rel_vs_cpu_ridge": 3.065946161557826e-05,
      "fp64_status": "unsupported",
      "fp64_rel_vs_cpu": null
    },
    {
      "engine": "pystatistics:gpu",
      "dataset": "glm_poisson",
      "n": 200000,
      "p": 128,
      "model_key": "glm_poisson",
      "lam": 100.0,
      "plain_status": "converged",
      "plain_rel_vs_cpu": 2.3376198661371616e-07,
      "ridge_status": "converged",
      "ridge_rel_vs_cpu_ridge": 6.282261498554593e-05,
      "fp64_status": "unsupported",
      "fp64_rel_vs_cpu": null
    },
    {
      "engine": "pystatistics:gpu",
      "dataset": "glm_poisson",
      "n": 500000,
      "p": 128,
      "model_key": "glm_poisson",
      "lam": 100.0,
      "plain_status": "converged",
      "plain_rel_vs_cpu": 3.0799525898922755e-07,
      "ridge_status": "converged",
      "ridge_rel_vs_cpu_ridge": 3.5650416896124e-05,
      "fp64_status": "unsupported",
      "fp64_rel_vs_cpu": null
    },
    {
      "engine": "pystatistics:gpu",
      "dataset": "glm_gamma",
      "n": 100000,
      "p": 64,
      "model_key": "glm_gamma",
      "lam": 100.0,
      "plain_status": "converged",
      "plain_rel_vs_cpu": 3.3234149681749204e-07,
      "ridge_status": "converged",
      "ridge_rel_vs_cpu_ridge": 6.323466082021026e-06,
      "fp64_status": "unsupported",
      "fp64_rel_vs_cpu": null
    },
    {
      "engine": "pystatistics:gpu",
      "dataset": "glm_gamma",
      "n": 200000,
      "p": 128,
      "model_key": "glm_gamma",
      "lam": 100.0,
      "plain_status": "converged",
      "plain_rel_vs_cpu": 0.0012811734737418687,
      "ridge_status": "converged",
      "ridge_rel_vs_cpu_ridge": 0.0015630677532563876,
      "fp64_status": "unsupported",
      "fp64_rel_vs_cpu": null
    },
    {
      "engine": "pystatistics:gpu",
      "dataset": "glm_gamma",
      "n": 500000,
      "p": 128,
      "model_key": "glm_gamma",
      "lam": 100.0,
      "plain_status": "converged",
      "plain_rel_vs_cpu": 3.4099864340744714e-07,
      "ridge_status": "converged",
      "ridge_rel_vs_cpu_ridge": 6.681384146759899e-06,
      "fp64_status": "unsupported",
      "fp64_rel_vs_cpu": null
    }
  ]
}