{
  "schema": "validation-run/v1",
  "env": {
    "pystatistics_version": "5.0.0",
    "install_source": "pypi",
    "python": "3.13.13",
    "numpy": "2.4.6",
    "os": "macOS-26.5.1-arm64-arm-64bit-Mach-O",
    "cpu": "arm",
    "device": "cpu",
    "torch": "2.13.0",
    "available_devices": [
      "mps",
      "cpu"
    ],
    "host": "powerhouse"
  },
  "config": {
    "study": "hardcases_r10",
    "scenarios": [
      "collinear",
      "separation_complete",
      "separation_quasi",
      "factor_interaction",
      "weights",
      "offset",
      "rank_deficient"
    ],
    "reference": "R lm()/glm()"
  },
  "records": [
    {
      "engine": "hardcase:collinear",
      "dataset": "synthetic",
      "n": 800,
      "p": 3,
      "scenario": "collinear",
      "np_cond": 20.35445776283167,
      "lib_cond_fp32": 20.354974734654387,
      "cpu_coef_max_rel_vs_r": 9.270645428160785e-16,
      "gpu_status": "accepted",
      "gpu_refuse_reason": "",
      "gpu_coef_rel_vs_cpu": 5.850501465091814e-05,
      "gpu_fitted_rel_vs_cpu": 3.90663958934876e-06,
      "gpu_rss_rel_vs_cpu": 3.167210782099251e-08,
      "gpu_force_status": "accepted"
    },
    {
      "engine": "hardcase:collinear",
      "dataset": "synthetic",
      "n": 800,
      "p": 3,
      "scenario": "collinear",
      "np_cond": 43.697853847115276,
      "lib_cond_fp32": 43.69737634934131,
      "cpu_coef_max_rel_vs_r": 3.8426672441848396e-16,
      "gpu_status": "accepted",
      "gpu_refuse_reason": "",
      "gpu_coef_rel_vs_cpu": 3.043354809688243e-05,
      "gpu_fitted_rel_vs_cpu": 9.566413148159562e-07,
      "gpu_rss_rel_vs_cpu": 1.6486899364090075e-09,
      "gpu_force_status": "accepted"
    },
    {
      "engine": "hardcase:collinear",
      "dataset": "synthetic",
      "n": 800,
      "p": 3,
      "scenario": "collinear",
      "np_cond": 94.03494897266383,
      "lib_cond_fp32": 94.06663088666956,
      "cpu_coef_max_rel_vs_r": 3.792734807635011e-16,
      "gpu_status": "accepted",
      "gpu_refuse_reason": "",
      "gpu_coef_rel_vs_cpu": 0.0009751948342339189,
      "gpu_fitted_rel_vs_cpu": 1.3691604427289765e-05,
      "gpu_rss_rel_vs_cpu": 3.99389115477604e-07,
      "gpu_force_status": "accepted"
    },
    {
      "engine": "hardcase:collinear",
      "dataset": "synthetic",
      "n": 800,
      "p": 3,
      "scenario": "collinear",
      "np_cond": 202.5038095737911,
      "lib_cond_fp32": 202.6400558754834,
      "cpu_coef_max_rel_vs_r": 2.715929180036844e-15,
      "gpu_status": "accepted",
      "gpu_refuse_reason": "",
      "gpu_coef_rel_vs_cpu": 0.0037835404951732862,
      "gpu_fitted_rel_vs_cpu": 2.5753835398745083e-05,
      "gpu_rss_rel_vs_cpu": 1.3249305314664762e-06,
      "gpu_force_status": "accepted"
    },
    {
      "engine": "hardcase:collinear",
      "dataset": "synthetic",
      "n": 800,
      "p": 3,
      "scenario": "collinear",
      "np_cond": 436.2025554977313,
      "lib_cond_fp32": 439.0345212060295,
      "cpu_coef_max_rel_vs_r": 2.102527567745289e-15,
      "gpu_status": "accepted",
      "gpu_refuse_reason": "",
      "gpu_coef_rel_vs_cpu": 0.024985140768636126,
      "gpu_fitted_rel_vs_cpu": 0.00010876464064415905,
      "gpu_rss_rel_vs_cpu": 2.5720574301278054e-05,
      "gpu_force_status": "accepted"
    },
    {
      "engine": "hardcase:collinear",
      "dataset": "synthetic",
      "n": 800,
      "p": 3,
      "scenario": "collinear",
      "np_cond": 939.6957256572512,
      "lib_cond_fp32": 926.3340139295608,
      "cpu_coef_max_rel_vs_r": 1.5847646976303728e-13,
      "gpu_status": "accepted",
      "gpu_refuse_reason": "",
      "gpu_coef_rel_vs_cpu": 0.1133669984329107,
      "gpu_fitted_rel_vs_cpu": 0.00011878236843395858,
      "gpu_rss_rel_vs_cpu": 2.9641744402684188e-05,
      "gpu_force_status": "accepted"
    },
    {
      "engine": "hardcase:collinear",
      "dataset": "synthetic",
      "n": 800,
      "p": 3,
      "scenario": "collinear",
      "np_cond": 2024.4409587157966,
      "lib_cond_fp32": 2232.9231442094283,
      "cpu_coef_max_rel_vs_r": 1.6671256676111714e-13,
      "gpu_status": "accepted",
      "gpu_refuse_reason": "",
      "gpu_coef_rel_vs_cpu": 0.44297563022288217,
      "gpu_fitted_rel_vs_cpu": 0.0004426353868745473,
      "gpu_rss_rel_vs_cpu": 0.0004344101776670629,
      "gpu_force_status": "accepted"
    },
    {
      "engine": "hardcase:collinear",
      "dataset": "synthetic",
      "n": 800,
      "p": 3,
      "scenario": "collinear",
      "np_cond": 4361.454684482672,
      "lib_cond_fp32": 3163.943806167123,
      "cpu_coef_max_rel_vs_r": 1.0098375270872581e-11,
      "gpu_status": "accepted",
      "gpu_refuse_reason": "",
      "gpu_coef_rel_vs_cpu": 0.052894914377852056,
      "gpu_fitted_rel_vs_cpu": 3.4388001290753355e-06,
      "gpu_rss_rel_vs_cpu": 2.918698781609562e-08,
      "gpu_force_status": "accepted"
    },
    {
      "engine": "hardcase:collinear",
      "dataset": "synthetic",
      "n": 800,
      "p": 3,
      "scenario": "collinear",
      "np_cond": 9396.398574622297,
      "lib_cond_fp32": 14238.606643571093,
      "cpu_coef_max_rel_vs_r": 3.5838527221085044e-12,
      "gpu_status": "accepted",
      "gpu_refuse_reason": "",
      "gpu_coef_rel_vs_cpu": 0.7370712088319289,
      "gpu_fitted_rel_vs_cpu": 0.0006119120415514008,
      "gpu_rss_rel_vs_cpu": 0.0007151079125010245,
      "gpu_force_status": "accepted"
    },
    {
      "engine": "hardcase:collinear",
      "dataset": "synthetic",
      "n": 800,
      "p": 3,
      "scenario": "collinear",
      "np_cond": 20243.856561964498,
      "lib_cond_fp32": null,
      "cpu_coef_max_rel_vs_r": 2.7408855637415077e-13,
      "gpu_status": "refused",
      "gpu_refuse_reason": "fp32-cholesky-breakdown",
      "gpu_coef_rel_vs_cpu": null,
      "gpu_fitted_rel_vs_cpu": null,
      "gpu_rss_rel_vs_cpu": null,
      "gpu_force_status": "accepted"
    },
    {
      "engine": "hardcase:separation_complete",
      "dataset": "synthetic",
      "n": 60,
      "p": 2,
      "pystat_warnings": [],
      "r_warnings": [
        "glm.fit: algorithm did not converge",
        "glm.fit: fitted probabilities numerically 0 or 1 occurred"
      ],
      "py_converged": false,
      "r_converged": false,
      "py_n_iter": 25,
      "case": "separation_complete",
      "pystat_behavior": "diverges (max|\u03b2|=277), converged=False@25",
      "r_behavior": "diverges (max|\u03b2|=353), converged=False, 2 warning(s)",
      "match": "behaviour-match",
      "coef_max_rel": 8.193627061388463,
      "detail": "glm.fit: algorithm did not converge"
    },
    {
      "engine": "hardcase:separation_quasi",
      "dataset": "synthetic",
      "n": 60,
      "p": 2,
      "pystat_warnings": [],
      "r_warnings": [
        "glm.fit: algorithm did not converge",
        "glm.fit: fitted probabilities numerically 0 or 1 occurred"
      ],
      "py_converged": false,
      "r_converged": false,
      "py_n_iter": 25,
      "case": "separation_quasi",
      "pystat_behavior": "diverges (max|\u03b2|=277), converged=False@25",
      "r_behavior": "diverges (max|\u03b2|=353), converged=False, 2 warning(s)",
      "match": "behaviour-match",
      "coef_max_rel": 0.21421852788050713,
      "detail": "glm.fit: algorithm did not converge"
    },
    {
      "engine": "hardcase:factor",
      "dataset": "synthetic",
      "n": 400,
      "p": 9,
      "py_names": [
        "(Intercept)",
        "z",
        "g3[b]",
        "g3[c]",
        "g2[y]",
        "g3[b]:g2[y]",
        "g3[c]:g2[y]",
        "g3[b]:z",
        "g3[c]:z"
      ],
      "r_names": [
        "(Intercept)",
        "z",
        "g3b",
        "g3c",
        "g2y",
        "g3b:g2y",
        "g3c:g2y",
        "z:g3b",
        "z:g3c"
      ],
      "bijection": true,
      "se_max_rel": 5.236501291058314e-16,
      "case": "factor_interaction",
      "pystat_behavior": "build_terms_design treatment contrasts (9 cols)",
      "r_behavior": "model.matrix default contrasts (9 cols)",
      "match": "yes",
      "coef_max_rel": 1.9409587203649252e-15,
      "detail": "design bijection=yes, se_max_rel=5.24e-16"
    },
    {
      "engine": "hardcase:weights",
      "dataset": "synthetic",
      "n": 4000,
      "p": 4,
      "se_max_rel": 6.7683344261542e-16,
      "gpu_coef_rel": 1.9786588435059168e-07,
      "case": "weights",
      "pystat_behavior": "supported (fit(weights=...)), CPU + GPU",
      "r_behavior": "R weighted lm",
      "match": "yes",
      "coef_max_rel": 9.42682287271489e-16,
      "detail": "se_max_rel=6.77e-16; GPU fp32 matches CPU to 2.0e-07"
    },
    {
      "engine": "hardcase:offset",
      "dataset": "synthetic",
      "n": 4000,
      "p": 4,
      "se_max_rel": 2.637634328533429e-07,
      "gpu_coef_rel": 1.6637625324918026e-07,
      "case": "offset",
      "pystat_behavior": "supported (fit(offset=...)), CPU + GPU",
      "r_behavior": "R offset poisson",
      "match": "yes",
      "coef_max_rel": 1.9907107085585877e-11,
      "detail": "se_max_rel=2.64e-07; GPU fp32 matches CPU to 1.7e-07"
    },
    {
      "engine": "hardcase:rank_deficient",
      "dataset": "synthetic",
      "n": 200,
      "p": 4,
      "py_nan_idx": [
        3
      ],
      "r_nan_idx": [
        3
      ],
      "case": "rank_deficient",
      "pystat_behavior": "drops aliased col\u2192NaN at index [3]",
      "r_behavior": "drops aliased col\u2192NA at index [3]",
      "match": "yes",
      "coef_max_rel": 3.682838825166275e-16,
      "detail": "aliased-position match=yes"
    }
  ]
}