{
  "schema": "validation-run/v1",
  "env": {
    "pystatistics_version": "5.0.0",
    "install_source": "pypi",
    "python": "3.13.13",
    "numpy": "2.4.6",
    "os": "macOS-26.5.1-arm64-arm-64bit-Mach-O",
    "cpu": "arm",
    "device": "cpu",
    "torch": "2.13.0",
    "available_devices": [
      "mps",
      "cpu"
    ],
    "host": "powerhouse"
  },
  "config": {
    "study": "convergence_diag_c5",
    "reference": "R glm(binomial) convergence behaviour on the identical design",
    "feature": "DiscreteTimeSolution.converged / .n_iter (new in 4.3.3, C5)"
  },
  "records": [
    {
      "engine": "convergence_diag:cpu",
      "dataset": "lung_coarse_5bin",
      "n": 227,
      "p": 3,
      "case": "lung_coarse_5bin",
      "n_events": 164,
      "n_intervals": 5,
      "person_period_n": 681,
      "py_converged": true,
      "py_n_iter": 4,
      "r_converged": true,
      "r_n_iter": 4,
      "r_warnings": "none",
      "max_abs_coef_r": 1.8686249460981197,
      "verdict": "flag-match"
    },
    {
      "engine": "convergence_diag:cpu",
      "dataset": "lung_default",
      "n": 227,
      "p": 3,
      "case": "lung_default",
      "n_events": 164,
      "n_intervals": 138,
      "person_period_n": 15809,
      "py_converged": true,
      "py_n_iter": 8,
      "r_converged": true,
      "r_n_iter": 8,
      "r_warnings": "none",
      "max_abs_coef_r": 5.897548812427152,
      "verdict": "flag-match"
    },
    {
      "engine": "convergence_diag:cpu",
      "dataset": "separation_extreme",
      "n": 60,
      "p": 2,
      "case": "separation_extreme",
      "n_events": 60,
      "n_intervals": 60,
      "person_period_n": 1830,
      "py_converged": true,
      "py_n_iter": 12,
      "r_converged": true,
      "r_n_iter": 12,
      "r_warnings": "none",
      "max_abs_coef_r": 13.761919970513171,
      "verdict": "flag-match"
    },
    {
      "engine": "convergence_diag:cpu",
      "dataset": "flchain_yearly",
      "n": 7874,
      "p": 7,
      "case": "flchain_yearly",
      "n_events": 2169,
      "n_intervals": 14,
      "person_period_n": 82919,
      "py_converged": true,
      "py_n_iter": 7,
      "r_converged": true,
      "r_n_iter": 7,
      "r_warnings": "none",
      "max_abs_coef_r": 4.689162909780603,
      "verdict": "flag-match"
    },
    {
      "engine": "convergence_diag:cpu",
      "dataset": "separated_covariate",
      "n": 80,
      "p": 1,
      "case": "separated_covariate",
      "n_events": 80,
      "n_intervals": 5,
      "person_period_n": 240,
      "py_converged": true,
      "py_n_iter": 18,
      "r_converged": true,
      "r_n_iter": 18,
      "r_warnings": "none",
      "max_abs_coef_r": 39.493983115991966,
      "verdict": "flag-match"
    },
    {
      "engine": "convergence_diag:cpu",
      "dataset": "all_censored",
      "n": 227,
      "p": 3,
      "case": "all_censored",
      "n_events": 0,
      "n_intervals": 5,
      "person_period_n": 681,
      "py_converged": false,
      "py_n_iter": 25,
      "r_converged": false,
      "r_n_iter": 25,
      "r_warnings": "glm.fit: algorithm did not converge",
      "max_abs_coef_r": 26.566068523538345,
      "verdict": "flag-match"
    }
  ]
}